review,aspect,key_aspect,count,product
i have tried many times to get a hold of apex who does not seem to answer their emails and telephone number is constantly busy as i believe the one lonely customer service rep is probably extremely overworked,overworked service rep,overworked service rep,1,Apex AD2600 Progressive-scan DVD player
the build quality shows why its so cheap small scratches on the base plate something that you would not see on a sony and an overall plasticky feel,overall feel,overall feel,1,Apex AD2600 Progressive-scan DVD player
having spent considerable time with professional video gear i find onscreen displays annoying,onscreen displays,onscreen displays,1,Apex AD2600 Progressive-scan DVD player
it did play a dvdr which was unplayable in my older philips machine,older machine,older machine,1,Apex AD2600 Progressive-scan DVD player
also i have not had trouble reading svcds that i created and vbr mp3 cds my old apex ad1200 had trouble with these ,old apex,old apex,1,Apex AD2600 Progressive-scan DVD player
the player usually plays dvds but has occasional problems such as 1 not recognizing a dvd 2 stopping a particular point in a movie every time we played it 3 not being able to access certain special features on a rental dvd,occasional problems,occasional problems,1,Apex AD2600 Progressive-scan DVD player
i have had this player for several months and it reads most discs but it would not recognize several discs that were clean and read on other players from friends season 2 ,not several discs,not several discs,1,Apex AD2600 Progressive-scan DVD player
weaknesses are minor the feel and layout of the remote control are only soso it does not show the complete filenames of mp3s with really long names you must cycle through every zoom setting 2x 3x 4x 12x etc before getting back to normal size sorry if i am just ignorant of a way to get back to 1x quickly ,not complete filenames,not complete filenames,1,Apex AD2600 Progressive-scan DVD player
i have sent my ad2600 back to apex because it will not play certain disney and other dvd movies no disc message ,not certain disney,not certain disney,1,Apex AD2600 Progressive-scan DVD player
tech support from apex is literally nonexistent,nonexistent tech support,nonexistent tech support,1,Apex AD2600 Progressive-scan DVD player
all in all trying to save some money on this player resulted in me shelling a great deal more when i purchased a much nicer dvd vcr combo player to make up for blazing crappiness of this very embarassing gift,nicer player,nicer player,1,Apex AD2600 Progressive-scan DVD player
for example i tried playing my new pirates of the carribean extra features dvd but this dvd player can not read it,new pirates,new pirates,1,Apex AD2600 Progressive-scan DVD player
new cds almost always began skipping after a few plays,new cds,new cds,1,Apex AD2600 Progressive-scan DVD player
it worked from 1226 to 19 at which time the picture failed completely see other negative reviewsmy unit was not the only one this happened to ,negative unit,negative unit,1,Apex AD2600 Progressive-scan DVD player
update the finish is more mirror than silver and i like it,more mirror,more mirror,1,Apex AD2600 Progressive-scan DVD player
i read in consumer reports that apex is a reliable brand but with my experience and reading the other reviews i think i will be doing a little more homework before considering another apex product,more homework,more homework,1,Apex AD2600 Progressive-scan DVD player
mixed bag i guess but the price was right,mixed bag,mixed bag,1,Apex AD2600 Progressive-scan DVD player
weaknesses are minor the feel and layout of the remote control are only soso it does not show the complete filenames of mp3s with really long names you must cycle through every zoom setting 2x 3x 4x 12x etc before getting back to normal size sorry if i am just ignorant of a way to get back to 1x quickly ,minor weaknesses,minor weaknesses,1,Apex AD2600 Progressive-scan DVD player
its low profile space saving design looks nice,low profile,low profile,1,Apex AD2600 Progressive-scan DVD player
seems to read most dvds fine and reads quietly i had a pioneer player that had fairly loud disc spin noise ,loud noise,loud noise,1,Apex AD2600 Progressive-scan DVD player
seemed like a good deal but this pos frequently cannot recognize dvds and music cds takes a long time loading and then concludes no disc,long time,long time,1,Apex AD2600 Progressive-scan DVD player
weaknesses are minor the feel and layout of the remote control are only soso it does not show the complete filenames of mp3s with really long names you must cycle through every zoom setting 2x 3x 4x 12x etc before getting back to normal size sorry if i am just ignorant of a way to get back to 1x quickly ,long names,long names,1,Apex AD2600 Progressive-scan DVD player
i have tried many times to get a hold of apex who does not seem to answer their emails and telephone number is constantly busy as i believe the one lonely customer service rep is probably extremely overworked,lonely service,lonely service,1,Apex AD2600 Progressive-scan DVD player
the machine is very light and slim and fits nicely into my tv stand,light machine,light machine,1,Apex AD2600 Progressive-scan DVD player
at first i thought it is only a isolated incident but i was proven wrong when the player would not read my alias dvds as well,isolated incident,isolated incident,1,Apex AD2600 Progressive-scan DVD player
there were sharp screw tips on the underside of the unit coming from inside that were obviously used to anchor the internal control board,internal board,internal board,1,Apex AD2600 Progressive-scan DVD player
imagine my shock and absolute instant disdain for any products made by apex,instant disdain,instant disdain,1,Apex AD2600 Progressive-scan DVD player
i did not want to have high expectations for this apex player because of the price but it is definitely working out much better than what i would expect from an expensive highend player,highend player,highend player,1,Apex AD2600 Progressive-scan DVD player
i did not want to have high expectations for this apex player because of the price but it is definitely working out much better than what i would expect from an expensive highend player,high expectations,high expectations,1,Apex AD2600 Progressive-scan DVD player
i am a more happier person after discovering the ip button,happier person,happier person,1,Apex AD2600 Progressive-scan DVD player
great feature list poor reliability,great list,great list,1,Apex AD2600 Progressive-scan DVD player
the aff feature did a great job converting the letterbox to fill 34 of the screen and the image still looked normal,great job,great job,1,Apex AD2600 Progressive-scan DVD player
i bought this apex 2600 dvd player for myself at christmas because it got good reviews as a good value for the money on a variety of different sites,good value,good value,1,Apex AD2600 Progressive-scan DVD player
the player looked good right out of the box offering lots of features and good styling,good styling,good styling,1,Apex AD2600 Progressive-scan DVD player
good looks,good looks,good looks,1,Apex AD2600 Progressive-scan DVD player
its very sleek looking with a very good front panel button layout and it has a great feature set,good layout,good layout,1,Apex AD2600 Progressive-scan DVD player
even viewed cds full of jpgs,full cds,full cds,1,Apex AD2600 Progressive-scan DVD player
the front door is miss aligned on my unit and you have to manually life it up just so slightly for the door to close a very annoying thing after ahwile,front door,front door,1,Apex AD2600 Progressive-scan DVD player
its very sleek looking with a very good front panel button layout and it has a great feature set,front button,front button,1,Apex AD2600 Progressive-scan DVD player
the dvd player is fine,fine dvd player,fine dvd player,1,Apex AD2600 Progressive-scan DVD player
the 2nd dvd player had a faulty power supply which caused to occasionally not turn on,faulty supply,faulty supply,1,Apex AD2600 Progressive-scan DVD player
the 2600 had false silver plate instead of play display,false plate,false plate,1,Apex AD2600 Progressive-scan DVD player
there are a couple of quirks that were a bit annoying like having to actually press the power button before the tray will open my prev machine did it automatically and the fact that the external display is too small and too faded to read from any significant distance,external display,external display,1,Apex AD2600 Progressive-scan DVD player
audio is excellent,excellent audio,excellent audio,1,Apex AD2600 Progressive-scan DVD player
all in all trying to save some money on this player resulted in me shelling a great deal more when i purchased a much nicer dvd vcr combo player to make up for blazing crappiness of this very embarassing gift,embarassing gift,embarassing gift,1,Apex AD2600 Progressive-scan DVD player
there are really easy directions for setup and fiddling around with the picture zoom etc,easy directions,easy directions,1,Apex AD2600 Progressive-scan DVD player
it sends discoutinous signals to tv so the tv has the pictures for one moment and has only the white noise for the other moment,discoutinous signals,discoutinous signals,1,Apex AD2600 Progressive-scan DVD player
another nice thing is that the unit has both optical and coax digital audio outputs though the latter was not mentioned in the literature id scanned before buying,digital outputs,digital outputs,1,Apex AD2600 Progressive-scan DVD player
my other gripe is the incredibly crappy remote which is worse than other cheaper apex units,crappy remote,crappy remote,1,Apex AD2600 Progressive-scan DVD player
having spent considerable time with professional video gear i find onscreen displays annoying,considerable time,considerable time,1,Apex AD2600 Progressive-scan DVD player
its a compact attractive machine and was easy to set up,compact machine,compact machine,1,Apex AD2600 Progressive-scan DVD player
my other gripe is the incredibly crappy remote which is worse than other cheaper apex units,cheaper units,cheaper units,1,Apex AD2600 Progressive-scan DVD player
the build quality shows why its so cheap small scratches on the base plate something that you would not see on a sony and an overall plasticky feel,cheap scratches,cheap scratches,1,Apex AD2600 Progressive-scan DVD player
the player usually plays dvds but has occasional problems such as 1 not recognizing a dvd 2 stopping a particular point in a movie every time we played it 3 not being able to access certain special features on a rental dvd,certain features,certain features,1,Apex AD2600 Progressive-scan DVD player
on 2 dvds so far it refuses to play certain episodes with no problems on the others on the dvd,certain episodes,certain episodes,1,Apex AD2600 Progressive-scan DVD player
i am giving this player cautious recommendation,cautious recommendation,cautious recommendation,1,Apex AD2600 Progressive-scan DVD player
for example i tried playing my new pirates of the carribean extra features dvd but this dvd player can not read it,carribean dvd,carribean dvd,1,Apex AD2600 Progressive-scan DVD player
the only thing i did experience was a problem of the player freezing while playing which i was able to clear by opening it up and blowing it out with canned air,canned air,canned air,1,Apex AD2600 Progressive-scan DVD player
i tried calling the support number for a week several times a day and always got a busy signal,busy signal,busy signal,1,Apex AD2600 Progressive-scan DVD player
the picture is clear bright and sharp and the sound is good,bright picture,bright picture,1,Apex AD2600 Progressive-scan DVD player
there were a few attractive features such as the small size and the layout of the remote,attractive features,attractive features,1,Apex AD2600 Progressive-scan DVD player
my other gripe is the incredibly crappy remote which is worse than other cheaper apex units,apex units,apex units,1,Apex AD2600 Progressive-scan DVD player
i use this with a home theater system and its amazing how it sounds the picture clarity is unmatched,amazing system,amazing system,1,Apex AD2600 Progressive-scan DVD player
it plays alternate video formats vcds svcds cvds very well,alternate formats,alternate formats,1,Apex AD2600 Progressive-scan DVD player
imagine my shock and absolute instant disdain for any products made by apex,absolute disdain,absolute disdain,1,Apex AD2600 Progressive-scan DVD player
the 2nd dvd player had a faulty power supply which caused to occasionally not turn on,2nd player,2nd player,1,Apex AD2600 Progressive-scan DVD player
this unit was working fine for the 1st month and a half and then the color signal disappeared,1st month,1st month,1,Apex AD2600 Progressive-scan DVD player
